{
  "matrixId": "requirements-acceptance-traceability",
  "version": "5.0.4",
  "status": "ACTIVE_AUTHORITY",
  "requirementCount": 49,
  "criterionCount": 84,
  "invariants": [
    "49 unique requirements equal 42 FR plus 7 NFR",
    "84 unique criteria equal AC-001 through AC-084",
    "requirement criterionIds and criterion requirementIds are exact reversible mirrors",
    "criterion authorityId authorityRef fixtureRef and requirementIds exactly mirror the acceptance catalog and fixture",
    "every requirement has one exact planRef and responsible component",
    "planComponents reverse exactly to requirement componentId values",
    "all plan, contract, schema, authority and fixture references resolve physically from the declared root",
    "semantic-only coverage is prohibited"
  ],
  "requirements": [
    {
      "requirementId": "FR-001",
      "statement": "CIK de 10 dígitos es la identidad primaria; ticker es alias no autoritativo.",
      "criterionIds": [
        "AC-001",
        "AC-003"
      ],
      "planRef": "specs/001-fundamental-analysis-platform/plan.md#component-identity",
      "planSection": "Identidad del emisor",
      "componentId": "COMP-IDENTITY",
      "contractRefs": [
        "specs/001-fundamental-analysis-platform/data-model.md",
        "specs/001-fundamental-analysis-platform/definitions/local-operation-issue-catalog.json"
      ],
      "schemaRefs": [
        "specs/001-fundamental-analysis-platform/schemas/common.schema.json",
        "specs/001-fundamental-analysis-platform/schemas/local-operation-issue.schema.json"
      ],
      "testStrategy": "fixtures de identidad, ambigüedad y resolución exacta por CIK; Vitest futuro y Playwright de selección"
    },
    {
      "requirementId": "FR-002",
      "statement": "una coincidencia ambigua produce `identity_ambiguous` local; nunca selección automática.",
      "criterionIds": [
        "AC-002"
      ],
      "planRef": "specs/001-fundamental-analysis-platform/plan.md#component-identity",
      "planSection": "Identidad del emisor",
      "componentId": "COMP-IDENTITY",
      "contractRefs": [
        "specs/001-fundamental-analysis-platform/data-model.md",
        "specs/001-fundamental-analysis-platform/definitions/local-operation-issue-catalog.json"
      ],
      "schemaRefs": [
        "specs/001-fundamental-analysis-platform/schemas/common.schema.json",
        "specs/001-fundamental-analysis-platform/schemas/local-operation-issue.schema.json"
      ],
      "testStrategy": "fixtures de identidad, ambigüedad y resolución exacta por CIK; Vitest futuro y Playwright de selección"
    },
    {
      "requirementId": "FR-003",
      "statement": "una operación SEC tiene presupuesto fijo de 14 llamadas externas.",
      "criterionIds": [
        "AC-003",
        "AC-009",
        "AC-081"
      ],
      "planRef": "specs/001-fundamental-analysis-platform/plan.md#component-sec-gateway",
      "planSection": "Gateway SEC y adquisición",
      "componentId": "COMP-SEC-GATEWAY",
      "contractRefs": [
        "specs/001-fundamental-analysis-platform/contracts/sec-acquisition-policy.json",
        "specs/001-fundamental-analysis-platform/contracts/sec-filing-fact-selection-policy.json",
        "specs/001-fundamental-analysis-platform/contracts/security-and-input-limits.json",
        "specs/001-fundamental-analysis-platform/contracts/openapi.yaml"
      ],
      "schemaRefs": [
        "specs/001-fundamental-analysis-platform/schemas/sec-acquisition.schema.json",
        "specs/001-fundamental-analysis-platform/schemas/sec-filing-fact-selection-policy.schema.json",
        "specs/001-fundamental-analysis-platform/schemas/security-and-input-limits.schema.json",
        "specs/001-fundamental-analysis-platform/schemas/problem-details.schema.json"
      ],
      "testStrategy": "OpenAPI/ref checks, fixtures SEC congelados, selección determinística, límites, retry/backoff y variantes HTTP"
    },
    {
      "requirementId": "FR-004",
      "statement": "Submissions y Company Facts se solicitan antes de cualquier Company Concept.",
      "criterionIds": [
        "AC-005",
        "AC-006",
        "AC-081"
      ],
      "planRef": "specs/001-fundamental-analysis-platform/plan.md#component-sec-gateway",
      "planSection": "Gateway SEC y adquisición",
      "componentId": "COMP-SEC-GATEWAY",
      "contractRefs": [
        "specs/001-fundamental-analysis-platform/contracts/sec-acquisition-policy.json",
        "specs/001-fundamental-analysis-platform/contracts/sec-filing-fact-selection-policy.json",
        "specs/001-fundamental-analysis-platform/contracts/security-and-input-limits.json",
        "specs/001-fundamental-analysis-platform/contracts/openapi.yaml"
      ],
      "schemaRefs": [
        "specs/001-fundamental-analysis-platform/schemas/sec-acquisition.schema.json",
        "specs/001-fundamental-analysis-platform/schemas/sec-filing-fact-selection-policy.schema.json",
        "specs/001-fundamental-analysis-platform/schemas/security-and-input-limits.schema.json",
        "specs/001-fundamental-analysis-platform/schemas/problem-details.schema.json"
      ],
      "testStrategy": "OpenAPI/ref checks, fixtures SEC congelados, selección determinística, límites, retry/backoff y variantes HTTP"
    },
    {
      "requirementId": "FR-005",
      "statement": "Company Concept se solicita solo para conceptos no resueltos, allowlisted y con mapping exacto `ACTIVE`.",
      "criterionIds": [
        "AC-007",
        "AC-081"
      ],
      "planRef": "specs/001-fundamental-analysis-platform/plan.md#component-sec-gateway",
      "planSection": "Gateway SEC y adquisición",
      "componentId": "COMP-SEC-GATEWAY",
      "contractRefs": [
        "specs/001-fundamental-analysis-platform/contracts/sec-acquisition-policy.json",
        "specs/001-fundamental-analysis-platform/contracts/sec-filing-fact-selection-policy.json",
        "specs/001-fundamental-analysis-platform/contracts/security-and-input-limits.json",
        "specs/001-fundamental-analysis-platform/contracts/openapi.yaml"
      ],
      "schemaRefs": [
        "specs/001-fundamental-analysis-platform/schemas/sec-acquisition.schema.json",
        "specs/001-fundamental-analysis-platform/schemas/sec-filing-fact-selection-policy.schema.json",
        "specs/001-fundamental-analysis-platform/schemas/security-and-input-limits.schema.json",
        "specs/001-fundamental-analysis-platform/schemas/problem-details.schema.json"
      ],
      "testStrategy": "OpenAPI/ref checks, fixtures SEC congelados, selección determinística, límites, retry/backoff y variantes HTTP"
    },
    {
      "requirementId": "FR-006",
      "statement": "el orden de fallback es estable: allowlist del perfil → prioridad de métrica → precedencia de mapping → conceptId.",
      "criterionIds": [
        "AC-008",
        "AC-013",
        "AC-081"
      ],
      "planRef": "specs/001-fundamental-analysis-platform/plan.md#component-sec-gateway",
      "planSection": "Gateway SEC y adquisición",
      "componentId": "COMP-SEC-GATEWAY",
      "contractRefs": [
        "specs/001-fundamental-analysis-platform/contracts/sec-acquisition-policy.json",
        "specs/001-fundamental-analysis-platform/contracts/sec-filing-fact-selection-policy.json",
        "specs/001-fundamental-analysis-platform/contracts/security-and-input-limits.json",
        "specs/001-fundamental-analysis-platform/contracts/openapi.yaml"
      ],
      "schemaRefs": [
        "specs/001-fundamental-analysis-platform/schemas/sec-acquisition.schema.json",
        "specs/001-fundamental-analysis-platform/schemas/sec-filing-fact-selection-policy.schema.json",
        "specs/001-fundamental-analysis-platform/schemas/security-and-input-limits.schema.json",
        "specs/001-fundamental-analysis-platform/schemas/problem-details.schema.json"
      ],
      "testStrategy": "OpenAPI/ref checks, fixtures SEC congelados, selección determinística, límites, retry/backoff y variantes HTTP"
    },
    {
      "requirementId": "FR-007",
      "statement": "agotado el presupuesto, se publica resultado `partial` si hay payload utilizable; no se ejecuta una llamada 15.",
      "criterionIds": [
        "AC-007",
        "AC-009",
        "AC-010",
        "AC-081"
      ],
      "planRef": "specs/001-fundamental-analysis-platform/plan.md#component-sec-gateway",
      "planSection": "Gateway SEC y adquisición",
      "componentId": "COMP-SEC-GATEWAY",
      "contractRefs": [
        "specs/001-fundamental-analysis-platform/contracts/sec-acquisition-policy.json",
        "specs/001-fundamental-analysis-platform/contracts/sec-filing-fact-selection-policy.json",
        "specs/001-fundamental-analysis-platform/contracts/security-and-input-limits.json",
        "specs/001-fundamental-analysis-platform/contracts/openapi.yaml"
      ],
      "schemaRefs": [
        "specs/001-fundamental-analysis-platform/schemas/sec-acquisition.schema.json",
        "specs/001-fundamental-analysis-platform/schemas/sec-filing-fact-selection-policy.schema.json",
        "specs/001-fundamental-analysis-platform/schemas/security-and-input-limits.schema.json",
        "specs/001-fundamental-analysis-platform/schemas/problem-details.schema.json"
      ],
      "testStrategy": "OpenAPI/ref checks, fixtures SEC congelados, selección determinística, límites, retry/backoff y variantes HTTP"
    },
    {
      "requirementId": "FR-008",
      "statement": "cada fact mantiene `factId`, concepto canónico, período, scope, decimal canónico, mapping/version y sourceRef.",
      "criterionIds": [
        "AC-006",
        "AC-011",
        "AC-012",
        "AC-015",
        "AC-019",
        "AC-020"
      ],
      "planRef": "specs/001-fundamental-analysis-platform/plan.md#component-normalization",
      "planSection": "Normalización XBRL y bundle fundamental",
      "componentId": "COMP-NORMALIZATION",
      "contractRefs": [